{
    "id": "pdf2foundry-my-book",
    "title": "My Book (PDF Import)",
    "description": "Imported Journals generated from a PDF using PDF2Foundry.",
    "version": "1.0.0",
    "authors": [
      { "name": "APAC Corp Services", "email": "martin.papy@cbtw.tech" }
    ],
    "compatibility": {
      "minimum": "12",
      "verified": "12"
    },
    "relationships": {
      "requires": [
        { "id": "compendium-folders", "type": "module", "compatibility": { "minimum": "12" } }
      ]
    },
    "packs": [
      {
        "name": "my-book-journals",
        "label": "My Book â€” Journals",
        "path": "packs/my-book-journals",
        "type": "JournalEntry"
      }
    ],
    "styles": [
      "styles/pdf2foundry.css"
    ],
    "media": [
      {
        "type": "cover",
        "url": "assets/cover.png"
      }
    ],
    "url": "https://example.com/pdf2foundry",
    "manifest": "https://example.com/pdf2foundry/module.json",
    "download": "https://example.com/pdf2foundry/module.zip",
    "readme": "https://example.com/pdf2foundry/README.md",
    "license": "OGL-1.0a"
  }
  